<?xml version="1.0" encoding="UTF-8"?>
<ns1:declar xsi:schemaLocation="urn://augo/smev/uslugi/1.0.0 declar-1.0.0.xsd" xmlns:xsi="http://www.w3.org/2001/XMLSchema-instance" xmlns:ns1="urn://augo/smev/uslugi/1.0.0">
	<ns1:declar_number>23156/564/5611Д</ns1:declar_number>
	<ns1:service>13.2</ns1:service>
	<ns1:register_date>2008-09-29</ns1:register_date>
	<ns1:end_date>2014-09-19</ns1:end_date>
	<ns1:AppliedDocument>
		<ns1:title>Заявление</ns1:title>
		<ns1:number>б/н</ns1:number>
		<ns1:date>2008-09-29</ns1:date>
		<ns1:url>https://12.345.67.89/download/AE4567BC</ns1:url>
		<ns1:url_valid_until>2008-09-30T17:41:17.783+04:00</ns1:url_valid_until>
	</ns1:AppliedDocument>
	<ns1:legal_entity>
		<ns1:name>Краткое наименование</ns1:name>
		<ns1:full_name>Полное наименование</ns1:full_name>
		<ns1:inn>25110201</ns1:inn>
		<ns1:kpp>251136652</ns1:kpp>
		<ns1:address>
			<ns1:Postal_Code>692500</ns1:Postal_Code>
			<ns1:Region>Приморский край</ns1:Region>
			<ns1:Locality>г.Уссурийск</ns1:Locality>
			<ns1:Street>ул.Ленина</ns1:Street>
			<ns1:House>101</ns1:House>
		</ns1:address>
		<ns1:ogrn>566214</ns1:ogrn>
		<ns1:phone>8 (4234) 319-303</ns1:phone>
		<ns1:email>ioib@adm-ussuriisk.ru</ns1:email>
		<ns1:bossFio>Фамилия Имя Отчество</ns1:bossFio>
		<ns1:buhFio>Фамилия Имя Отчество</ns1:buhFio>
		<ns1:bank>Отделение №1 по ПК в г.Владивосток</ns1:bank>
		<ns1:bankAccount>52300000000446</ns1:bankAccount>
		<ns1:person>
			<ns1:surname>Фамилия</ns1:surname>
			<ns1:first_name>Имя</ns1:first_name>
			<ns1:patronymic>Отчество</ns1:patronymic>
			<ns1:address>
				<ns1:Locality>г.Уссурийск</ns1:Locality>
				<ns1:Street>пр.Блюхера</ns1:Street>
				<ns1:House>1Б</ns1:House>
				<ns1:Apartment>26</ns1:Apartment>
			</ns1:address>
			<ns1:phone>89241234567</ns1:phone>
		</ns1:person>
	</ns1:legal_entity>
	<ns1:person>
		<ns1:surname>Бендер</ns1:surname>
		<ns1:first_name>Остап</ns1:first_name>
		<ns1:patronymic>Ибрагимович</ns1:patronymic>
		<ns1:address>
			<ns1:Locality>г.Уссурийск</ns1:Locality>
			<ns1:Street>ул.Некрасова</ns1:Street>
			<ns1:House>91</ns1:House>
			<ns1:Housing>А</ns1:Housing>
			<ns1:Apartment>34</ns1:Apartment>
		</ns1:address>
		<ns1:passport_serial>0502</ns1:passport_serial>
		<ns1:passport_number>554654</ns1:passport_number>
		<ns1:passport_agency>РОВД г.Уссурийск</ns1:passport_agency>
		<ns1:passport_date>2019-08-19</ns1:passport_date>
		<ns1:phone>89021234567</ns1:phone>
		<ns1:sex>Муж</ns1:sex>
	</ns1:person>
	<ns1:confidant>
		<ns1:surname>Фамилия</ns1:surname>
		<ns1:first_name>Имя</ns1:first_name>
		<ns1:address>
			<ns1:Locality>г.Уссурийск</ns1:Locality>
			<ns1:Street>ул.Ленина</ns1:Street>
			<ns1:House>95</ns1:House>
			<ns1:Housing>Б</ns1:Housing>
			<ns1:Apartment>59</ns1:Apartment>
		</ns1:address>
		<ns1:phone>89141234567</ns1:phone>
	</ns1:confidant>
	<ns1:Param type="String" id="object_type" label="Вид объекта услуги">Значение</ns1:Param>
</ns1:declar>
